{
  "$schema": "http://json-schema.org/draft-07/schema#",
  "$id": "https://wrt-release.local/recipes/schemas/recipe.schema.json",
  "type": "object",
  "additionalProperties": false,
  "required": [
    "name",
    "description",
    "enabled",
    "phase",
    "depends",
    "conflicts",
    "tags",
    "when",
    "actions"
  ],
  "properties": {
    "$schema": { "type": "string" },
    "name": {
      "type": "string",
      "pattern": "^[a-z0-9_-]+$"
    },
    "description": { "type": "string" },
    "enabled": { "type": "boolean" },
    "priority": { "type": "integer" },
    "phase": {
      "type": "string",
      "enum": [
        "pre_clone",
        "post_clone",
        "pre_feeds",
        "post_feeds_update",
        "post_feeds_install",
        "pre_defconfig",
        "post_defconfig",
        "finalize"
      ]
    },
    "depends": {
      "type": "array",
      "items": { "type": "string", "pattern": "^[a-z0-9_-]+$" },
      "uniqueItems": true
    },
    "conflicts": {
      "type": "array",
      "items": { "type": "string", "pattern": "^[a-z0-9_-]+$" },
      "uniqueItems": true
    },
    "tags": {
      "type": "array",
      "items": { "type": "string" },
      "uniqueItems": true
    },
    "when": {
      "type": "object",
      "additionalProperties": false,
      "required": ["targets", "repo", "branch", "tags"],
      "properties": {
        "targets": { "type": "array", "items": { "type": "string" }, "uniqueItems": true },
        "repo": { "type": "array", "items": { "type": "string" }, "uniqueItems": true },
        "branch": { "type": "array", "items": { "type": "string" }, "uniqueItems": true },
        "tags": { "type": "array", "items": { "type": "string" }, "uniqueItems": true }
      }
    },
    "actions": {
      "type": "object",
      "additionalProperties": false,
      "required": [
        "addFeeds",
        "removeFeeds",
        "importPackages",
        "removePackageDirs",
        "patches",
        "files",
        "configs",
        "script"
      ],
      "properties": {
        "addFeeds": {
          "type": "array",
          "items": { "type": "string" }
        },
        "removeFeeds": {
          "type": "array",
          "items": { "type": "string" },
          "uniqueItems": true
        },
        "importPackagesRegistry": {
          "type": "object",
          "propertyNames": {
            "pattern": "^[a-z0-9][a-z0-9._-]*$"
          },
          "additionalProperties": {
            "type": "object",
            "additionalProperties": false,
            "required": ["gitUrl"],
            "properties": {
              "gitUrl": { "type": "string" },
              "branch": { "type": ["string", "null"] },
              "tag": { "type": ["string", "null"] },
              "commit": { "type": ["string", "null"] },
              "latestRelease": { "type": ["boolean", "null"] },
              "depth": { "type": ["integer", "null"], "minimum": 1 },
              "sparseRoot": { "type": ["string", "null"] }
            }
          }
        },
        "importPackages": {
          "type": "array",
          "items": {
            "type": "object",
            "additionalProperties": false,
            "required": ["source", "path"],
            "properties": {
              "source": { "type": "string" },
              "path": { "type": "string" },
              "packageName": { "type": "string" },
              "script": { "type": "string" },
              "fixLuciMk": { "type": "boolean" }
            }
          }
        },
        "removePackageDirs": {
          "type": "array",
          "items": { "type": "string" },
          "uniqueItems": true
        },
        "patches": {
          "type": "array",
          "items": {
            "type": "object",
            "additionalProperties": false,
            "required": ["source", "target"],
            "properties": {
              "source": { "type": "string" },
              "target": { "type": "string" },
              "strip": { "type": "integer", "minimum": 0 },
              "binary": { "type": "boolean" },
              "ignoreWhitespace": { "type": "boolean" },
              "forward": { "type": "boolean" },
              "backup": { "type": "boolean" },
              "rejectFile": { "type": "boolean" },
              "fuzz": { "type": "integer", "minimum": 0 }
            }
          }
        },
        "files": {
          "type": "array",
          "items": {
            "type": "object",
            "additionalProperties": false,
            "required": ["source", "target"],
            "properties": {
              "source": { "type": "string" },
              "target": { "type": "string" },
              "mode": { "type": "string", "pattern": "^[0-7]{3,4}$" },
              "append": { "type": "boolean" }
            }
          }
        },
        "configs": {
          "type": "array",
          "items": { "type": "string" },
          "uniqueItems": true
        },
        "script": {
          "type": ["string", "null"]
        }
      }
    }
  }
}
