{
  "$schema": "../recipe.schema.json",
  "name": "disable_easytier",
  "description": "禁用 easytier 集成，移除由主脚本导入的 easytier 包并关闭相关编译配置",
  "enabled": false,
  "phase": "pre_defconfig",
  "depends": [],
  "conflicts": [],
  "tags": [
    "disable",
    "easytier"
  ],
  "when": {
    "targets": [],
    "repo": [],
    "branch": [],
    "tags": []
  },
  "actions": {
    "addFeeds": [],
    "removeFeeds": [],
    "importPackages": [],
    "removePackageDirs": [
      "custom_feed/easytier",
      "custom_feed/luci-app-easytier",
      "package/feeds/custom_feed/easytier",
      "package/feeds/custom_feed/luci-app-easytier"
    ],
    "patches": [],
    "files": [],
    "configs": [
      "configs/disable_easytier.config"
    ],
    "script": null
  }
}
