{
  "$schema": "../recipe.schema.json",
  "name": "passwall",
  "description": "预装 PassWall 并精简内置组件（禁用 Shadowsocks/SingBox/Trojan 等老旧/冗余协议依赖）",
  "enabled": false,
  "phase": "pre_defconfig",
  "depends": [],
  "conflicts": [],
  "tags": [
    "network",
    "proxy",
    "passwall"
  ],
  "when": {
    "targets": [],
    "repo": [],
    "branch": [],
    "tags": []
  },
  "actions": {
    "addFeeds": [],
    "removeFeeds": [],
    "importPackages": [],
    "removePackageDirs": [],
    "patches": [],
    "files": [],
    "configs": [
      "configs/passwall.config"
    ],
    "script": null
  }
}
