{
  "$schema": "../recipe.schema.json",
  "name": "banip",
  "description": "配置 BanIP 防火墙黑名单/IP 拦截组件",
  "enabled": false,
  "phase": "pre_defconfig",
  "depends": [],
  "conflicts": [],
  "tags": [
    "security",
    "firewall",
    "banip"
  ],
  "when": {
    "targets": [],
    "repo": [],
    "branch": [],
    "tags": []
  },
  "actions": {
    "addFeeds": [],
    "removeFeeds": [],
    "importPackages": [],
    "removePackageDirs": [],
    "patches": [],
    "files": [],
    "configs": [
      "configs/banip.config"
    ],
    "script": null
  }
}
