{
  "$schema": "../recipe.schema.json",
  "name": "bash_completion",
  "description": "为固件集成 bash-completion (命令自动补全支持)",
  "enabled": false,
  "phase": "pre_defconfig",
  "depends": [],
  "conflicts": [],
  "tags": [
    "shell",
    "terminal",
    "bash",
    "bash-completion"
  ],
  "when": {
    "targets": [],
    "repo": [],
    "branch": [],
    "tags": []
  },
  "actions": {
    "addFeeds": [],
    "removeFeeds": [],
    "importPackages": [],
    "removePackageDirs": [],
    "patches": [],
    "files": [
      {
        "source": "files/root/.bashrc",
        "target": "package/base-files/files/root/.bashrc",
        "append": true
      },
      {
        "source": "files/root/.profile",
        "target": "package/base-files/files/root/.profile",
        "append": true
      }
    ],
    "configs": [
      "configs/bash_completion.config"
    ],
    "script": "apply.sh"
  }
}
