{
  "$schema": "../recipe.schema.json",
  "name": "mt7986",
  "description": "配置 MediaTek MT7986 芯片的 proprietary AP 无线网卡驱动参数",
  "enabled": true,
  "phase": "pre_defconfig",
  "depends": [
    "mt798x_hnat"
  ],
  "conflicts": [
    "mt7981"
  ],
  "tags": [
    "wifi",
    "driver",
    "mt7986",
    "ap"
  ],
  "when": {
    "targets": [],
    "repo": [],
    "branch": [],
    "tags": [
      "mt7986"
    ]
  },
  "actions": {
    "addFeeds": [],
    "removeFeeds": [],
    "importPackages": [],
    "removePackageDirs": [],
    "patches": [],
    "files": [],
    "configs": [
      "configs/mt7986.config"
    ],
    "script": null
  }
}