{
  "$schema": "../recipe.schema.json",
  "name": "base",
  "description": "Enable core storage mounting support on every device",
  "enabled": true,
  "phase": "pre_defconfig",
  "depends": [],
  "conflicts": [],
  "tags": [
    "base",
    "storage",
    "system"
  ],
  "when": {
    "targets": [],
    "repo": [],
    "branch": [],
    "tags": []
  },
  "actions": {
    "addFeeds": [],
    "removeFeeds": [],
    "importPackages": [],
    "removePackageDirs": [],
    "patches": [],
    "files": [],
    "configs": [
      "configs/base.config"
    ],
    "script": null
  }
}
