{
  "$schema": "../recipe.schema.json",
  "name": "docker_compose",
  "description": "预装 docker-compose 并通过脚本将其源码版本升级到最新版本，适应 v5 编译规范",
  "enabled": false,
  "phase": "pre_defconfig",
  "depends": [],
  "conflicts": [],
  "tags": [
    "docker",
    "compose",
    "utility"
  ],
  "when": {
    "targets": [],
    "repo": [],
    "branch": [],
    "tags": []
  },
  "actions": {
    "addFeeds": [],
    "removeFeeds": [],
    "importPackages": [],
    "removePackageDirs": [],
    "patches": [],
    "files": [],
    "configs": [
      "configs/docker-compose.config"
    ],
    "script": "apply.sh"
  }
}
